{
  "schema_version": "1.0",
  "max_attempts_by_tier": {
    "0": 3,
    "1": 3,
    "2": 2,
    "3": 2,
    "4": 1
  },
  "repeated_failure_per_tier": 2,
  "repeated_failure_total": 3,
  "max_contract_repairs": 1,
  "max_blocker_resumptions": 3,
  "max_architect_diagnoses": 5,
  "max_context_chars": 40000,
  "max_history_entries": 5,
  "attempt_timeout_seconds": 600
}
